{
  "object_id": "obj_demo_order",
  "object_type": "pgo_test_order",
  "schema_version": "1.0.0",
  "revision": 1,
  "created_at": "2026-09-16T12:15:00Z",
  "created_by": "pgp_clinical_planning",
  "input_refs": [
    {
      "object_id": "obj_demo_form_test_ordering",
      "revision": 1
    },
    {
      "object_id": "obj_demo_consent",
      "revision": 1
    },
    {
      "object_id": "obj_demo_genes",
      "revision": 1
    }
  ],
  "data": {
    "order_number": "PG-DEMO-ORDER-001",
    "patient": {
      "subject_id": "subject_demo_001",
      "full_name": "Alex Example",
      "date_of_birth": "1990-01-01",
      "identifier": "PATIENT-DEMO-001"
    },
    "objective": "Evaluate the synthetic three-gene demonstration",
    "clinical_suspicion": "Demo clinical hypothesis only",
    "scope": {
      "genes": [
        "PGGENE_A",
        "PGGENE_B",
        "PGGENE_C"
      ],
      "reference_id": "PG_DEMO_REF_1",
      "variant_classes": [
        "SNV",
        "small_indel"
      ]
    },
    "fulfillment": {
      "wet_lab_output_type": "pgo_sequence_reads",
      "final_output_types": [
        "pgo_interactive_report",
        "pgo_pdf_report"
      ],
      "required_profile": "pg_demo_small_variant_v1",
      "scope_policy": "requested_only",
      "analysis_support_required": true
    },
    "consent_ref": {
      "object_id": "obj_demo_consent",
      "revision": 1
    },
    "candidate_genes_ref": {
      "object_id": "obj_demo_genes",
      "revision": 1
    },
    "requested_by": "user_demo_001",
    "issued_at": "2026-09-16T12:15:00Z",
    "status": "issued"
  },
  "files": []
}
